{
  "taskId": "TASK-CAPTURE-20250108-C1M2N3",
  "applicationId": "APP-20250108-F7K9M2",
  "completedTimestamp": "2025-01-08T14:35:42Z",
  "completedBy": "USER-KYC-001",
  "clientId": "CLI-20250108-000234",
  "crmRecordCreated": true,
  "crmRecordId": "CRM-2025-0108-000234",
  "dataQualityScore": 98.5,
  "dataCompleteness": "complete",
  "validatedClientData": {
    "clientType": "individual",
    "basicDetails": {
      "title": "Ms",
      "firstName": "Sarah",
      "middleNames": "Elizabeth",
      "lastName": "Chen",
      "dateOfBirth": "1985-06-15",
      "nationality": "GBR",
      "taxResidency": ["GBR"],
      "taxIdentificationNumber": "AB123456C",
      "employmentStatus": "employed",
      "occupation": "Software Engineer",
      "sourceOfWealth": "employment"
    },
    "contactDetails": {
      "emailAddress": "sarah.chen@example.com",
      "phoneNumber": "+441632112233",
      "mobileNumber": "+447700900123"
    },
    "address": {
      "addressLine1": "42 Kensington Garden Road",
      "addressLine2": "Flat 3B",
      "city": "London",
      "postalCode": "W2 4BH",
      "country": "GBR"
    },
    "tradingProfile": {
      "estimatedAnnualVolume": 150000,
      "assetClasses": ["equities", "fixed-income"],
      "tradingFrequency": "regular"
    },
    "initialDepositAmount": 50000
  },
  "enrichmentData": {
    "companyHouseCheck": false,
    "addressVerification": "verified",
    "duplicateCheck": {
      "performed": true,
      "duplicatesFound": false,
      "potentialMatches": []
    }
  },
  "kycOfficerNotes": "Standard individual application. All data provided is complete and consistent. Email verified via confirmation link. Phone number verified via SMS code. Address verified against Royal Mail PAF database. No concerns raised. Client profile appears straightforward - employed professional in technology sector with reasonable trading expectations.",
  "flagsRaised": [],
  "nextDocumentsRequired": [
    "passport",
    "proof-of-address-utility"
  ],
  "processingDuration": 204
}